{
  "$schema": "rusty.hostess.project_runner.evidence_receipt_binding.v1",
  "profile_id": "qcl-100-full-stereo",
  "profile_sha256": "1be847efbb4e702172054bfe599b7ffad94df3ade5115c28cd4a2f48f401ca0b",
  "project_id": "hostess-network-workflow",
  "project_revision": 1,
  "project_spec_sha256": "6aacae990b037e0579e4d40addd12f09bb28b1436bdcd95646e50a11274cdc01",
  "product_id": "broker.media-session.standalone",
  "product_lock_id": "lock.broker.media-session.standalone",
  "product_lock_revision": 1,
  "product_lock_fingerprint": "fnv1a64-006d1c87d57a0438",
  "product_lock_sha256": "d99c51fa2b5f4a7dfa8a66268f9ca1d98c87bff307dff35a81d491c7e5943657",
  "authority_revision": 11,
  "issued_at_utc": "2026-07-11T11:55:00Z",
  "expires_at_utc": "2026-07-11T12:10:00Z",
  "evidence_tier": "standard",
  "fatal_count": 0,
  "observations": {
    "bounded_exchange": true,
    "inactive_cleanup": true,
    "package_cleanup": true,
    "zero_fatals": true
  },
  "owner_receipt_ref": {
    "path": "owner-receipts/quest-generic-media-evidence.json",
    "sha256": "33eb457ab9f7b7a6cc28415aa6688ff2fdf139104f9730b4df573a50ce5fba9d",
    "schema": "rusty.quest.generic_media_session_evidence.v1",
    "owner": "rusty.quest"
  }
}
